BACTERIAL INFECTION,COLD PANNICULITIS,CHRONS DISEASE,DEEP FUNGAL INFECTION,ERYTHEMA NODOSUM,ERYTHEMA NODOSUM LEPROSUM,FACTITIAL PANNICULITIS,GRANULOMA ANNULARE,LEUKOCYTOCLASTIC VASCULITIS,LIPODYSTROPHY,LUCIOS PHENOMENON,LUPUS ERYTHEMATOSUS PROFUNDUS,MYCOBACTERIAL INFECTION,MYCOSIS FUNGOIDES,NECROBIOSIS LIPOIDICA,NECROBIOTIC XANTHOGRANULOMA,NODULAR VASCULITIS,PANCREATIC PANNICULITIS,PARASITIC INFECTION,POLYARTERITIS NODOSA,POSTSTEROID PANNICULITIS,RHEUMATOID NODULE,SARCOIDOSIS,SCLEREMA NEONATORUM,SCLERODERMA,SUBCUTANEOUS FAT NECROSIS,THROMBOPHLEBITIS,TRAUMATIC FAT NECROSISNO Vasculitis,NO Vasculitis,Vasculitis of artery,NO Vasculitis,NO Vasculitis,Vasculitis of venule,NO Vasculitis,NO Vasculitis,Vasculitis of venule,NO Vasculitis,Vasculitis of venule,NO Vasculitis,NO Vasculitis,NO Vasculitis,NO Vasculitis,NO Vasculitis,Vasculitis of artery,NO Vasculitis,NO Vasculitis,Vasculitis of artery,NO Vasculitis,NO Vasculitis,NO Vasculitis,NO Vasculitis,NO Vasculitis,NO Vasculitis,Vasculitis of vein,NO VasculitisNeutrophilic inflammatory infiltrate in lobule,Lymphocytic inflammatory infiltrate in lobule,Lymphocytic inflammatory infiltrate in lobule,Neutrophilic inflammatory infiltrate in lobule,Histiocytic inflammatory infiltrate in septa,Neutrophilic inflammatory infiltrate in lobule,Neutrophilic inflammatory infiltrate in lobule,Histiocytic inflammatory infiltrate in septa,Neutrophilic inflammatory infiltrate in septa,Histiocytic inflammatory infiltrate in lobule,Neutrophilic inflammatory infiltrate in lobule,Lymphocytic inflammatory infiltrate in lobule,Neutrophilic inflammatory infiltrate in lobule,Inflammatory infiltrate of abnormal lymphocytes in lobule,Lymphocytic inflammatory infiltrate in septa,Histiocytic inflammatory infiltrate in septa,Neutrophilic inflammatory infiltrate in lobule,Neutrophilic inflammatory infiltrate in lobule,Neutrophilic inflammatory infiltrate in lobule,Neutrophilic inflammatory infiltrate in septa,Histiocytic inflammatory infiltrate in lobule,Histiocytic inflammatory infiltrate in septa,Lymphocytic inflammatory infiltrate in lobule,Histiocytic inflammatory infiltrate in lobule,Lymphocytic inflammatory infiltrate in septa,Histiocytic inflammatory infiltrate in lobule,Lymphocytic inflammatory infiltrate in septa,Histiocytic inflammatory infiltrate in lobuleBacteria,Histiocytic inflammatory infiltrate in lobule,,Histiocytic inflammatory infiltrate in lobule,Radial granuloma in septa,Lymphocytic inflammatory infiltrate in lobule,,Palisaded granuloma,Eosinophilic inflammatory infiltrate in septa,Needle-shaped cleft in adipocyte,Nuclear dust,Plasma cell inflammatory infiltrate in lobule,Histiocytic inflammatory infiltrate in lobule,,Plasma cell inflammatory infiltrate in septa,Lipophages,Lymphocytic inflammatory infiltrate in lobule,Necrosis of adipocytes,Histiocytic inflammatory infiltrate in lobule,Lymphocytic inflammatory infiltrate in septa,Needle-shaped cleft in adipocyte OR Needle-shaped cleft in histiocyte,Fibrin,Histiocytic inflammatory infiltrate in lobule,Needle-shaped cleft in adipocyte OR Needle-shaped cleft in histiocyte,Plasma cell inflammatory infiltrate in septa,Needle-shaped cleft in adipocyte OR Needle-shaped cleft in histiocyte,Histiocytic inflammatory infiltrate in septa,NO Focal needle-shaped cleft in adipocyte,Moderate lymphocytic inflammatory infiltrate in dermis OR Marked lymphocytic inflammatory infitrate in dermis,,Hyphae OR Spores,NO Mucin,Histiocytic inflammatory infiltrate in lobule,,Mucin,Lymphocytic inflammatory infiltrate in septa,,,Nuclear dust,Mycobacteria,,Granuloma in septa,Granuloma in septa,Plasma cell inflammatory infiltrate in lobule,,Mites OR Progeny of mites OR Detritus of mites,Nuclear dust,,Palisaded granuloma,NO Focal needle-shaped cleft in adipocyte,,Granuloma in septa,,Neutrophilic inflammatory infiltrate in septa,,,,,NO Fibrin,Plasma cell inflammatory infiltrate in lobule,,,Nuclear dust,,,,,,,Degenerated collagen,Necrosis of adipocytes,,,,,,,,,,,,,,,NO Degenerated collagen,Foam cells in lobule,,,,,,,,,,Cholesterol cleft,MAY Histiocytic inflammatory infiltrate in lobule,,,,,,,,,,,,,,,,Focal necrosis of adipocytes,,,,,,,,,,Necrosis of inflammatory cells in center of palisaded granuloma,,,,,,,,,,,,,,,,,,,,,,,,,,,Palisaded granuloma,,,,,,,,,,,,